{
  "ok": true,
  "config": {
    "schemaVersion": 1,
    "catalogueVersion": "1.0.0",
    "rev": 2,
    "generatedAt": "2026-11-03T08:30:00Z",
    "checks": [
      {
        "id": "edge.hsts",
        "title": "HSTS header",
        "category": "edge",
        "source": "plugin",
        "enabled": true,
        "clientVisible": true,
        "defaultSeverity": "high",
        "severity": "high",
        "severityOverride": null,
        "defaultSchedule": "1h",
        "schedule": "6h",
        "frequency": "6h",
        "snoozedUntil": null,
        "note": null,
        "acknowledged": null,
        "adjustable": {
          "enabled": true,
          "clientVisible": true,
          "severity": [
            "high",
            "medium",
            "low"
          ],
          "schedule": [
            "1h",
            "6h",
            "1d"
          ],
          "snooze": false
        }
      },
      {
        "id": "edge.csp_mode",
        "title": "Content Security Policy mode",
        "category": "edge",
        "source": "plugin",
        "enabled": true,
        "clientVisible": false,
        "defaultSeverity": "medium",
        "severity": "medium",
        "severityOverride": null,
        "defaultSchedule": "1h",
        "schedule": null,
        "frequency": "1h",
        "snoozedUntil": null,
        "note": "Report-only by design until the O-2 switch date.",
        "acknowledged": null,
        "adjustable": {
          "enabled": true,
          "clientVisible": false,
          "severity": [
            "high",
            "medium",
            "low"
          ],
          "schedule": [
            "1h",
            "6h",
            "1d",
            "1w"
          ],
          "snooze": true
        }
      },
      {
        "id": "host.file_perms",
        "title": "File permissions on the host",
        "category": "host",
        "source": "worker",
        "enabled": true,
        "clientVisible": false,
        "defaultSeverity": "high",
        "severity": "high",
        "severityOverride": null,
        "defaultSchedule": "1d",
        "schedule": null,
        "frequency": "1d",
        "snoozedUntil": null,
        "note": null,
        "acknowledged": null,
        "adjustable": {
          "enabled": true,
          "clientVisible": false,
          "severity": [
            "high",
            "medium",
            "low"
          ],
          "schedule": [],
          "snooze": false
        }
      },
      {
        "id": "data.db_integrity",
        "title": "Database integrity",
        "category": "data",
        "source": "plugin",
        "enabled": true,
        "clientVisible": true,
        "defaultSeverity": "critical",
        "severity": "critical",
        "severityOverride": null,
        "defaultSchedule": "1d",
        "schedule": null,
        "frequency": "1d",
        "snoozedUntil": null,
        "note": null,
        "acknowledged": null,
        "adjustable": {
          "enabled": true,
          "clientVisible": true,
          "severity": [],
          "schedule": [],
          "snooze": true
        }
      },
      {
        "id": "email.dkim",
        "title": "DKIM record",
        "category": "email",
        "source": "plugin",
        "enabled": false,
        "clientVisible": false,
        "defaultSeverity": "medium",
        "severity": "medium",
        "severityOverride": null,
        "defaultSchedule": "1d",
        "schedule": null,
        "frequency": "1d",
        "snoozedUntil": null,
        "note": "DKIM moves to the new mail provider this week.",
        "acknowledged": null,
        "adjustable": {
          "enabled": true,
          "clientVisible": false,
          "severity": [
            "high",
            "medium",
            "low"
          ],
          "schedule": [
            "1d",
            "1w"
          ],
          "snooze": false
        }
      }
    ],
    "alerts": {
      "emailOnCritical": true,
      "dedupeHours": 12,
      "recipientsMode": "site",
      "siteRecipients": 2
    },
    "worker": {
      "configured": true,
      "lastSeenAt": "2026-11-03T05:30:00Z"
    },
    "lastChange": {
      "rev": 2,
      "at": "2026-11-03T08:30:00Z",
      "source": "os",
      "by": {
        "kind": "human",
        "id": null,
        "name": null,
        "role": "PM",
        "osUserId": "7b2e4c1a-3f5d-4e8a-9c0b-1d2e3f4a5b6c",
        "source": "os"
      }
    },
    "limits": {
      "ackDefaultDays": 7,
      "ackMaxDays": 30,
      "ackCriticalMaxDays": 7
    }
  },
  "applied": [
    {
      "id": "edge.hsts",
      "field": "schedule"
    },
    {
      "id": "email.dkim",
      "field": "enabled"
    },
    {
      "id": "email.dkim",
      "field": "note"
    },
    {
      "id": "alerts",
      "field": "dedupeHours"
    }
  ],
  "rejected": [
    {
      "id": "data.db_integrity",
      "field": "severityOverride",
      "reason": "not_adjustable",
      "message": "The severity of data.db_integrity is fixed by the catalogue"
    }
  ]
}
